{
  "$schema": "../../schemas/v1/package.schema.json",
  "id": "telegram",
  "title": "Telegram",
  "description": "Linutil Store application definition for telegram.",
  "kind": "application",
  "state": "draft",
  "category": "linutil-store",
  "categories": [
    "communication"
  ],
  "tags": [],
  "availability": "optional",
  "platforms": [
    "linux"
  ],
  "dependencies": [],
  "delivery": {
    "manager": "flatpak",
    "package": "org.telegram.desktop",
    "scope": "user"
  },
  "actions": [
    {
      "id": "telegram.install",
      "phase": "install",
      "executor": "flatpak",
      "run": [
        "org.telegram.desktop"
      ]
    }
  ],
  "validation": [
    {
      "id": "telegram.ready",
      "check": [
        "command",
        "telegram"
      ],
      "expected": "telegram is available",
      "required": true
    }
  ],
  "metrics": [
    "package-queued",
    "package-fetched",
    "package-installed",
    "validation-passed",
    "validation-failed"
  ],
  "links": [
    "https://linutil.christitus.com/userguide/store/"
  ]
}
