{
  "$schema": "../../schemas/v1/package.schema.json",
  "id": "youtubedl-gui",
  "title": "Youtubedl Gui",
  "description": "Initial baseline payload definition for youtubedl-gui.",
  "kind": "application",
  "state": "draft",
  "category": "baseline",
  "platforms": [
    "linux"
  ],
  "dependencies": [],
  "delivery": {
    "manager": "apt",
    "package": "youtubedl-gui",
    "scope": "system"
  },
  "actions": [
    {
      "id": "youtubedl-gui.install",
      "phase": "install",
      "executor": "apt",
      "run": [
        "youtubedl-gui"
      ]
    }
  ],
  "validation": [
    {
      "id": "youtubedl-gui.command",
      "check": [
        "command",
        "youtubedl-gui"
      ],
      "expected": "youtubedl-gui is available",
      "required": true
    }
  ],
  "metrics": [
    "package-queued",
    "package-fetched",
    "package-installed",
    "validation-passed",
    "validation-failed"
  ]
}

