{
  "$schema": "../../schemas/v1/package.schema.json",
  "id": "ollama",
  "title": "Ollama",
  "description": "Initial optional payload definition for ollama.",
  "kind": "service",
  "state": "draft",
  "category": "optional",
  "platforms": [
    "linux"
  ],
  "dependencies": [],
  "delivery": {
    "manager": "script",
    "package": "ollama",
    "scope": "user"
  },
  "actions": [
    {
      "id": "ollama.install",
      "phase": "install",
      "executor": "script",
      "run": [
        "ollama"
      ]
    }
  ],
  "validation": [
    {
      "id": "ollama.command",
      "check": [
        "command",
        "ollama"
      ],
      "expected": "ollama is available",
      "required": true
    }
  ],
  "metrics": [
    "package-queued",
    "package-fetched",
    "package-installed",
    "validation-passed",
    "validation-failed"
  ]
}

