{
  "$schema": "../../schemas/v1/package.schema.json",
  "id": "linuxbrew",
  "title": "Linuxbrew",
  "description": "User-local Linuxbrew bootstrap and PATH setup.",
  "kind": "tool",
  "state": "draft",
  "category": "bootstrap",
  "platforms": [
    "linux"
  ],
  "dependencies": [],
  "delivery": {
    "manager": "script",
    "package": "linuxbrew",
    "scope": "system"
  },
  "actions": [
    {
      "id": "linuxbrew.install",
      "phase": "bootstrap",
      "executor": "script",
      "run": [
        "linuxbrew"
      ]
    }
  ],
  "validation": [
    {
      "id": "linuxbrew.ready",
      "check": [
        "command",
        "linuxbrew"
      ],
      "expected": "linuxbrew is available",
      "required": true
    }
  ],
  "metrics": [
    "package-queued",
    "package-fetched",
    "package-installed",
    "validation-passed",
    "validation-failed"
  ]
}
