{
  "$schema": "../../schemas/v1/package.schema.json",
  "id": "github-cli",
  "title": "Github Cli",
  "description": "Initial baseline payload definition for github-cli.",
  "kind": "tool",
  "state": "draft",
  "category": "baseline",
  "platforms": [
    "linux"
  ],
  "dependencies": [],
  "delivery": {
    "manager": "apt",
    "package": "gh",
    "scope": "system"
  },
  "actions": [
    {
      "id": "github-cli.install",
      "phase": "install",
      "executor": "apt",
      "run": [
        "gh"
      ]
    }
  ],
  "validation": [
    {
      "id": "github-cli.command",
      "check": [
        "command",
        "github-cli"
      ],
      "expected": "github-cli is available",
      "required": true
    }
  ],
  "metrics": [
    "package-queued",
    "package-fetched",
    "package-installed",
    "validation-passed",
    "validation-failed"
  ]
}

