{
  "$schema": "../../schemas/v1/package.schema.json",
  "id": "vocalinux",
  "title": "Vocalinux",
  "description": "Initial optional payload definition for vocalinux.",
  "kind": "application",
  "state": "draft",
  "category": "optional",
  "platforms": [
    "linux"
  ],
  "dependencies": [],
  "delivery": {
    "manager": "appimage",
    "package": "vocalinux",
    "scope": "user"
  },
  "actions": [
    {
      "id": "vocalinux.install",
      "phase": "install",
      "executor": "appimage",
      "run": [
        "vocalinux"
      ]
    }
  ],
  "validation": [
    {
      "id": "vocalinux.command",
      "check": [
        "command",
        "vocalinux"
      ],
      "expected": "vocalinux is available",
      "required": true
    }
  ],
  "metrics": [
    "package-queued",
    "package-fetched",
    "package-installed",
    "validation-passed",
    "validation-failed"
  ]
}

