{
  "$schema": "../../schemas/v1/package.schema.json",
  "id": "leaf",
  "title": "Leaf",
  "description": "Initial baseline payload definition for leaf.",
  "kind": "tool",
  "state": "draft",
  "category": "baseline",
  "platforms": [
    "linux"
  ],
  "dependencies": [],
  "delivery": {
    "manager": "script",
    "package": "leaf",
    "scope": "system"
  },
  "actions": [
    {
      "id": "leaf.install",
      "phase": "install",
      "executor": "script",
      "run": [
        "leaf"
      ]
    }
  ],
  "validation": [
    {
      "id": "leaf.command",
      "check": [
        "command",
        "leaf"
      ],
      "expected": "leaf is available",
      "required": true
    }
  ],
  "metrics": [
    "package-queued",
    "package-fetched",
    "package-installed",
    "validation-passed",
    "validation-failed"
  ]
}

