{
  "$schema": "../../schemas/v1/package.schema.json",
  "id": "carelo",
  "title": "Carelo",
  "description": "Initial optional payload definition for carelo.",
  "kind": "application",
  "state": "draft",
  "category": "optional",
  "platforms": [
    "linux"
  ],
  "dependencies": [],
  "delivery": {
    "manager": "appimage",
    "package": "carelo",
    "scope": "user"
  },
  "actions": [
    {
      "id": "carelo.install",
      "phase": "install",
      "executor": "appimage",
      "run": [
        "carelo"
      ]
    }
  ],
  "validation": [
    {
      "id": "carelo.command",
      "check": [
        "command",
        "carelo"
      ],
      "expected": "carelo is available",
      "required": true
    }
  ],
  "metrics": [
    "package-queued",
    "package-fetched",
    "package-installed",
    "validation-passed",
    "validation-failed"
  ]
}

