{
  "$schema": "../../schemas/v1/package.schema.json",
  "id": "foot",
  "title": "Foot",
  "description": "Initial optional payload definition for foot.",
  "kind": "application",
  "state": "draft",
  "category": "optional",
  "platforms": [
    "linux"
  ],
  "dependencies": [],
  "delivery": {
    "manager": "apt",
    "package": "foot",
    "scope": "user"
  },
  "actions": [
    {
      "id": "foot.install",
      "phase": "install",
      "executor": "apt",
      "run": [
        "foot"
      ]
    }
  ],
  "validation": [
    {
      "id": "foot.command",
      "check": [
        "command",
        "foot"
      ],
      "expected": "foot is available",
      "required": true
    }
  ],
  "metrics": [
    "package-queued",
    "package-fetched",
    "package-installed",
    "validation-passed",
    "validation-failed"
  ]
}

