{
  "$schema": "../../schemas/v1/package.schema.json",
  "id": "java",
  "title": "Java",
  "description": "Initial optional payload definition for java.",
  "kind": "tool",
  "state": "draft",
  "category": "optional",
  "platforms": [
    "linux"
  ],
  "dependencies": [],
  "delivery": {
    "manager": "mise",
    "package": "java@latest",
    "scope": "user"
  },
  "actions": [
    {
      "id": "java.install",
      "phase": "install",
      "executor": "mise",
      "run": [
        "java@latest"
      ]
    }
  ],
  "validation": [
    {
      "id": "java.command",
      "check": [
        "command",
        "java"
      ],
      "expected": "java is available",
      "required": true
    }
  ],
  "metrics": [
    "package-queued",
    "package-fetched",
    "package-installed",
    "validation-passed",
    "validation-failed"
  ]
}

