{
  "$schema": "../../schemas/v1/package.schema.json",
  "id": "beyond-compare",
  "title": "Beyond Compare",
  "description": "Initial deb payload definition for beyond-compare.",
  "kind": "application",
  "state": "draft",
  "category": "deb",
  "platforms": [
    "linux"
  ],
  "dependencies": [],
  "delivery": {
    "manager": "deb",
    "package": "bcompare",
    "scope": "user"
  },
  "actions": [
    {
      "id": "beyond-compare.install",
      "phase": "install",
      "executor": "deb",
      "run": [
        "bcompare"
      ]
    }
  ],
  "validation": [
    {
      "id": "beyond-compare.command",
      "check": [
        "command",
        "beyond-compare"
      ],
      "expected": "beyond-compare is available",
      "required": true
    }
  ],
  "metrics": [
    "package-queued",
    "package-fetched",
    "package-installed",
    "validation-passed",
    "validation-failed"
  ]
}

