{
  "$schema": "../../schemas/v1/package.schema.json",
  "id": "zellij",
  "title": "Zellij",
  "description": "Initial optional payload definition for zellij.",
  "kind": "tool",
  "state": "draft",
  "category": "optional",
  "platforms": [
    "linux"
  ],
  "dependencies": [],
  "delivery": {
    "manager": "curl",
    "package": "zellij",
    "scope": "user"
  },
  "actions": [
    {
      "id": "zellij.install",
      "phase": "install",
      "executor": "curl",
      "run": [
        "zellij"
      ]
    }
  ],
  "validation": [
    {
      "id": "zellij.command",
      "check": [
        "command",
        "zellij"
      ],
      "expected": "zellij is available",
      "required": true
    }
  ],
  "metrics": [
    "package-queued",
    "package-fetched",
    "package-installed",
    "validation-passed",
    "validation-failed"
  ]
}

